[
 {
  "code": "BRCA",
  "gaps": [
   "Five ductal/NST patients were sampled after neoadjuvant therapy and one has unknown timing; use the treatment filter for an untreated design.",
   "One further HTAN ductal donor could be added if its specimen is confirmed as the initial primary rather than recurrent-site tissue.",
   "Several larger breast spatial cohorts release only downsampled images or are not yet released."
  ],
  "name": "Breast invasive carcinoma",
  "group": "hausser",
  "hausser": "significant",
  "strata": [
   [
    "brca-idc",
    "Invasive ductal carcinoma / NST"
   ],
   [
    "brca-ilc",
    "Invasive lobular carcinoma"
   ]
  ],
  "summary": "Breast cancer is one of six TCGA cancer types in which Hausser et al. found significant within-type polyhedral structure in tumour expression, and one of the six pooled in their shared-task analysis. Ductal/NST and lobular carcinomas are kept as separate strata here.",
  "tcga_project": "BRCA",
  "analysis_cohort": "BRCA"
 },
 {
  "code": "COAD",
  "gaps": [
   "TCGA-COAD is analysed with TCGA-READ as the pooled colorectal cohort (CRC); its counts here are provenance, and two COAD-submitted rectal primaries previously excluded for site alone are now included in CRC.",
   "Valdeolivas et al. sections must be located on the original whole-slide scans before patch-level alignment.",
   "The Colon Molecular Atlas Project (HTAN Vanderbilt) is the largest candidate expansion and needs histology review.",
   "Most HTAN colorectal sections are from metastatic deposits and are kept separate from the primary stratum."
  ],
  "name": "Colon adenocarcinoma",
  "group": "hausser",
  "hausser": "significant",
  "strata": [
   [
    "coad-conv",
    "Conventional colon adenocarcinoma"
   ]
  ],
  "summary": "Colon adenocarcinoma met the strong significance criterion in Hausser et al. and contributed to the pooled six-cancer analysis. Mucinous carcinomas and metastatic deposits are listed but kept outside the conventional primary stratum.",
  "tcga_project": "COAD",
  "analysis_cohort": "CRC"
 },
 {
  "code": "READ",
  "gaps": [
   "TCGA-READ does not meet the screen on its own (156 patients, 94 with both assays after assay QC); it contributes to the pooled CRC cohort, which does. The earlier standalone exclusion is superseded.",
   "Only two patients have primary-tumour sections with matched data located; the same registration step as for colon applies.",
   "One Visium HD rectal section is under review because its primary status is not stated."
  ],
  "name": "Rectal adenocarcinoma",
  "group": "extension",
  "hausser": "not-screened",
  "strata": [
   [
    "read-conv",
    "Conventional rectal adenocarcinoma"
   ]
  ],
  "summary": "Rectal adenocarcinoma was not part of the Hausser et al. geometry analysis. It is kept as a separate rectal stratum for spatial data, and TCGA-READ is analysed together with TCGA-COAD as the pooled colorectal cohort (CRC).",
  "tcga_project": "READ",
  "analysis_cohort": "CRC",
  "rationale": "Colorectal extension; pooled in CRC"
 },
 {
  "code": "CRC",
  "name": "Colorectal adenocarcinoma",
  "group": "pooled",
  "hausser": "not-screened",
  "strata": [],
  "summary": "Colon and rectal adenocarcinomas pooled as one colorectal analysis cohort. The TCGA colorectal study characterised both together and found broadly similar genomic alterations outside the hypermutated group; molecular features also vary along the bowel. The submitted project, reported anatomical site, MSI/MMR status and methylation phenotype should be kept as annotations for location-association checks and colon-only sensitivity analyses. The administrative COAD/READ split should not be treated as a biological boundary.",
  "tcga_project": null,
  "analysis_cohort": "CRC",
  "tcga_projects": [
   "COAD",
   "READ"
  ],
  "includes": [
   "COAD",
   "READ"
  ],
  "gaps": [
   "COAD and READ contributions are submitted-project provenance, not adjudicated pure colon and rectum strata; reported GDC site fields can disagree with each other and with case annotations.",
   "MSI/MMR status and methylation phenotype are not included in this release; they need to be joined from the TCGA colorectal study or PanCanAtlas subtype resources before location analyses.",
   "Spatial resources listed here include colon, rectal and colorectal specimens whose bowel site is not stated.",
   "Treatment-flagged patients are not a treated reference set; one normal-reference donor carries a recurrence annotation.",
   "Patient identity across COAD and READ was checked from identifiers and annotations, not by genotype."
  ],
  "unstated_label": "Bowel site not stated",
  "evidence_notes": {
   "hausser-2019": "Hausser et al. analysed TCGA-COAD only. Colon adenocarcinoma met their strong significance criterion and was part of the pooled six-cancer analysis. TCGA-READ, with fewer primary tumours, was not among the 15 cancer types screened, and the pooled colorectal cohort has not been tested for archetype geometry."
  }
 },
 {
  "code": "THCA",
  "gaps": [
   "Both patients with primary-tumour sections located have background Hashimoto thyroiditis and no reported treatment history; no case of classical-variant papillary carcinoma alone is verified.",
   "Further thyroid spatial cohorts lack released original-resolution scans or require requests."
  ],
  "name": "Thyroid carcinoma",
  "group": "hausser",
  "hausser": "significant",
  "strata": [
   [
    "thca-ptc",
    "Papillary thyroid carcinoma, variant not specified"
   ]
  ],
  "summary": "Thyroid carcinoma met the strong significance criterion in Hausser et al. and contributed to the pooled analysis. Papillary carcinoma variants and background thyroiditis are recorded where sources report them.",
  "tcga_project": "THCA",
  "analysis_cohort": "THCA"
 },
 {
  "code": "BLCA",
  "gaps": [
   "Variant morphology of the four primary tumours with located data has not been reviewed.",
   "A larger untreated muscle-invasive cohort (GSE319536) releases only downsampled H&E."
  ],
  "name": "Bladder urothelial carcinoma",
  "group": "hausser",
  "hausser": "significant",
  "strata": [
   [
    "blca-mibc",
    "High-grade muscle-invasive urothelial carcinoma"
   ]
  ],
  "summary": "Bladder urothelial carcinoma met the strong significance criterion in Hausser et al. and contributed to the pooled analysis. Variant morphology is not always reported and may need pathology review.",
  "tcga_project": "BLCA",
  "analysis_cohort": "BLCA"
 },
 {
  "code": "LGG",
  "gaps": [
   "TCGA-LGG contributes 502 patients, all with both assays, to the glioma classification benchmark (GLIOMA); the LGG-only subset is not counted as a separate cohort.",
   "Historical histology and grade predate the integrated WHO classification of CNS tumours (2021). Published IDH and 1p/19q groups are annotations; an integrated diagnosis and grade have not been adjudicated.",
   "No package with verified original-resolution H&E has been confirmed yet.",
   "The Hoefflin et al. archive names candidate astrocytoma and oligodendroglioma donors; scan resolution and grade assignments still need checking."
  ],
  "name": "Lower-grade glioma",
  "group": "hausser",
  "hausser": "significant",
  "strata": [
   [
    "lgg-astro",
    "IDH-mutant astrocytoma, grade 2/3"
   ],
   [
    "lgg-oligo",
    "IDH-mutant, 1p/19q-codeleted oligodendroglioma, grade 2/3"
   ]
  ],
  "summary": "Lower-grade glioma met the strong significance criterion in Hausser et al. and contributed to the pooled analysis. The TCGA LGG cohort predates current molecular glioma classification, so astrocytoma and oligodendroglioma are separated here using IDH and 1p/19q status where available. In the TCGA analyses, LGG is part of the pooled glioma classification benchmark with TCGA-GBM rather than a discovery cohort; the LGG-only set is a subset of that benchmark.",
  "tcga_project": "LGG",
  "analysis_cohort": "GLIOMA"
 },
 {
  "code": "GBM",
  "gaps": [
   "Below the screen on its own (242 patients, 51 with both assays after assay QC). After the patient screen 225 remain, but only 46 have both RNA-seq and 450k, so GBM adds few paired cases to the benchmark.",
   "Among the 225, the pan-glioma study assigns 202 to IDH-wildtype and 11 to IDH-mutant non-codeleted groups; 12 have no complete group, although some of them have an IDH call.",
   "Historical GBM is not a verified integrated WHO diagnosis, and IDH-wildtype status alone does not make a tumour glioblastoma.",
   "One patient submitted under GBM is annotated as lower-grade glioma and keeps both labels. One received dexamethasone and phenytoin before procurement; this is recorded as supportive medication, not antineoplastic pretreatment.",
   "The five normal RNA + H&E packages come from normal-only donors without a reported primary diagnosis. They are not verified matched glioblastoma controls.",
   "Two glioma spatial resources include glioblastoma: 13 IDH-wildtype GBM sections from five donor labels (Greenwald et al.) and an anatomical-niche atlas of 32 genotyped glioma sections. Original H&E for part of the first is available through a separate archive, but aliases, coverage and registration are unresolved; neither is a verified matched package."
  ],
  "name": "Glioblastoma (historical TCGA diagnosis)",
  "group": "extension",
  "hausser": "not-screened",
  "strata": [],
  "summary": "TCGA-GBM is used only within the pooled glioma classification benchmark, with TCGA-LGG. Its diagnoses are historical histological categories that predate the integrated molecular classification of CNS tumours; they are kept as labels to be compared with an independently curated integrated diagnosis, not treated as one.",
  "tcga_project": "GBM",
  "analysis_cohort": "GLIOMA",
  "rationale": "Glioma benchmark extension; pooled in GLIOMA"
 },
 {
  "code": "GLIOMA",
  "name": "Diffuse glioma classification benchmark",
  "group": "pooled",
  "hausser": "not-screened",
  "strata": [],